{
  "gerado_em": "2026-10-28",
  "fonte": "git log --all --no-merges (data do commit) nos 3 repositórios",
  "meses": [
    "2024-03",
    "2024-04",
    "2024-05",
    "2024-06",
    "2024-07",
    "2024-08",
    "2024-09",
    "2024-10",
    "2024-11",
    "2024-12",
    "2025-01",
    "2025-02",
    "2025-03",
    "2025-04",
    "2025-05",
    "2025-06",
    "2025-07",
    "2025-08",
    "2025-09",
    "2025-10",
    "2025-11",
    "2025-12",
    "2026-01",
    "2026-02",
    "2026-03",
    "2026-04",
    "2026-05",
    "2026-06",
    "2026-07",
    "2026-08",
    "2026-09",
    "2026-10"
  ],
  "projetos": {
    "landing": {
      "nome": "Landing (voltaexpressbrasil)",
      "commits": 29,
      "primeiro": "2024-03-20",
      "ultimo": "2026-10-27",
      "por_mes": {
        "2024-03": 1,
        "2026-04": 16,
        "2026-05": 1,
        "2026-08": 5,
        "2026-10": 6
      }
    },
    "plataforma": {
      "nome": "Plataforma (voltaexpress)",
      "commits": 56,
      "primeiro": "2025-01-01",
      "ultimo": "2026-10-02",
      "por_mes": {
        "2025-01": 1,
        "2026-02": 14,
        "2026-03": 10,
        "2026-04": 14,
        "2026-05": 11,
        "2026-10": 6
      }
    },
    "hub": {
      "nome": "Hub (voltaexpressbrasil-hub)",
      "commits": 22,
      "primeiro": "2026-05-27",
      "ultimo": "2026-10-27",
      "por_mes": {
        "2026-05": 4,
        "2026-08": 15,
        "2026-10": 3
      }
    }
  },
  "total_commits": 107,
  "marcos": [
    {
      "data": "2024-03-20",
      "projeto": "Landing",
      "titulo": "Primeiro commit da landing",
      "descricao": "Início do repositório voltaexpressbrasil, que hoje publica a home e as duas landings.",
      "fonte": "git log do repositório voltaexpressbrasil (commit 2c4497c)"
    },
    {
      "data": "2024-09-14",
      "projeto": "Pesquisa",
      "titulo": "Formulários de interesse exportados",
      "descricao": "Embarcadores e caminhoneiros responderam aos formulários de interesse; 42 respostas entram na pesquisa agregada.",
      "fonte": "Metadados das planilhas exportadas do Microsoft Forms (repositório privado); resultado em data/pesquisa.json"
    },
    {
      "data": "2024-11-17",
      "projeto": "Plataforma",
      "titulo": "Vídeo da versão 4.2",
      "descricao": "Gravação de navegação da versão 4.2, com mapa de rotas. O arquivo foi recebido por WhatsApp nessa data.",
      "fonte": "Nome do arquivo VID-20241117-WA0026.mp4 (idêntico a volta-express-v4.2.mp4, mesmo hash)"
    },
    {
      "data": "2025-09-04",
      "projeto": "Landing",
      "titulo": "Versão 5: login e cadastro no Quero Carregar",
      "descricao": "Login e cadastro com localStorage e implantação no Google Apps Script.",
      "fonte": "README da landing, seção \"Versão 5\""
    },
    {
      "data": "2026-02-09",
      "projeto": "Plataforma",
      "titulo": "Banco de dados da plataforma no Supabase",
      "descricao": "Primeira migração: tabelas de usuário, veículo, carga, localização e anúncio, com RLS.",
      "fonte": "voltaexpress/supabase/migrations/20260209231304_*.sql (commit 68b892f)"
    },
    {
      "data": "2026-05-27",
      "projeto": "Hub",
      "titulo": "Primeiro commit do Hub",
      "descricao": "Início do repositório de ativos e documentação da Volta Express.",
      "fonte": "git log do repositório voltaexpressbrasil-hub (commit 45619a7)"
    },
    {
      "data": "2026-09-28",
      "projeto": "Plataforma",
      "titulo": "Match v2 e proteção de dados",
      "descricao": "Match no banco com PostGIS, score de 0 a 100 com motivos, telefone só após interesse e expiração diária dos anúncios.",
      "fonte": "voltaexpress/supabase/migrations/20260928120*.sql e docs/MATCH.md"
    },
    {
      "data": "2026-10-01",
      "projeto": "Landing",
      "titulo": "Imagens em WebP",
      "descricao": "Peso das imagens do Quero Transportar caiu de ~45 MB para ~330 KB.",
      "fonte": "voltaexpressbrasil, commit 0f8279a e docs/RELATORIO.md"
    },
    {
      "data": "2026-10-01",
      "projeto": "Hub",
      "titulo": "Catálogo público sem dados pessoais (B0.1)",
      "descricao": "Formulários, pitch, atas e prints internos saíram do catálogo público.",
      "fonte": "voltaexpressbrasil-hub, commit a4bdee9 e docs/B0-PROTECAO-DE-DADOS.md"
    },
    {
      "data": "2026-10-26",
      "projeto": "Landing",
      "titulo": "Landing v7: design system e conversão",
      "descricao": "0 caminhos de conversão quebrados, 0 falhas de contraste e CSS 55% menor nas 3 páginas.",
      "fonte": "voltaexpressbrasil/CHANGELOG.md e docs/RELATORIO.md"
    },
    {
      "data": "2026-10-27",
      "projeto": "Hub",
      "titulo": "Hub v7: central de evidências",
      "descricao": "O Hub passa de navegador de arquivos a relatórios, pesquisa, demonstrações, explicações, jornada e marca, com dados gerados por script.",
      "fonte": "voltaexpressbrasil-hub/CHANGELOG.md"
    },
    {
      "data": "2026-10-28",
      "projeto": "Plataforma",
      "titulo": "Plataforma v3: pronta para demonstração",
      "descricao": "Personas \"Tenho caminhão\" e \"Tenho carga\", Política de Privacidade com aceite registrado, indicador de frete fechado e Home com a tese do frete de retorno.",
      "fonte": "voltaexpress/CHANGELOG.md (branch feature/projeto)"
    }
  ]
}
